{
  "$schema": "http://json-schema.org/draft-07/schema#",
  "$id": "geoworld://schemas/tooling/behavior-tree/1",
  "type": "object",
  "additionalProperties": false,
  "required": ["schema_version", "tree_id", "root", "nodes"],
  "properties": {
    "schema_version": { "const": 1 },
    "tree_id": { "type": "string", "minLength": 1 },
    "root": { "type": "string", "minLength": 1 },
    "nodes": {
      "type": "array",
      "minItems": 1,
      "items": {
        "type": "object",
        "additionalProperties": false,
        "required": ["id", "type", "name", "position", "children", "parameters"],
        "properties": {
          "id": { "type": "string", "minLength": 1 },
          "type": { "type": "string", "minLength": 1 },
          "name": { "type": "string", "minLength": 1 },
          "position": {
            "type": "object",
            "additionalProperties": false,
            "required": ["x", "y"],
            "properties": {
              "x": { "type": "number" },
              "y": { "type": "number" }
            }
          },
          "children": {
            "type": "array",
            "items": { "type": "string", "minLength": 1 }
          },
          "parameters": {
            "type": "object",
            "additionalProperties": { "type": "string" }
          }
        }
      }
    }
  }
}
