{"nodes":[{"children":["check_alarm","mark_ready"],"id":"root_sequence","name":"应急处置","parameters":{},"position":{"x":320.0,"y":80.0},"type":"Sequence"},{"children":[],"id":"check_alarm","name":"检查告警","parameters":{"code":"alarm == true"},"position":{"x":140.0,"y":265.0},"type":"ScriptCondition"},{"children":[],"id":"mark_ready","name":"进入就绪","parameters":{},"position":{"x":466.0,"y":299.0},"type":"AlwaysSuccess"}],"root":"root_sequence","schema_version":1,"tree_id":"EmergencyResponse"}